Description,cluster
"RECORD FRAME 7"" SINGLE SIZE ",1
STRAWBERRY CERAMIC TRINKET BOX,2
PINK DOUGHNUT TRINKET POT ,2
SAVE THE PLANET MUG,1
LOVE BUILDING BLOCK WORD,1
HOME BUILDING BLOCK WORD,1
ASSORTED COLOUR BIRD ORNAMENT,0
FULL ENGLISH BREAKFAST PLATE,1
PIZZA PLATE IN BOX,1
SET OF 3 BLACK FLYING DUCKS,1
SMALL MARSHMALLOWS PINK BOWL,0
SCOTTIE DOG HOT WATER BOTTLE,2
PACK OF 6 SKULL PAPER CUPS,1
PACK OF 20 SKULL PAPER NAPKINS,1
HANGING HEART ZINC T-LIGHT HOLDER,1
PINK BLUE FELT CRAFT TRINKET BOX,0
FELTCRAFT DOLL EMILY,0
VINTAGE SNAKES & LADDERS,2
CHOCOLATE HOT WATER BOTTLE,2
DINOSAURS  WRITING SET ,1
JUMBO BAG TOYS ,2
GINGHAM HEART  DOORSTOP RED,0
CHARLIE+LOLA PINK HOT WATER BOTTLE,2
CHARLIE + LOLA RED HOT WATER BOTTLE,2
TOMATO CHARLIE+LOLA COASTER SET,2
CARROT CHARLIE+LOLA COASTER SET,2
CHARLIE & LOLA WASTEPAPER BIN FLORA,2
BAKING SET 9 PIECE RETROSPOT ,1
RED TOADSTOOL LED NIGHT LIGHT,1
ASSORTED COLOUR MINI CASES,1
POSTAGE,2
RED WOOLLY HOTTIE WHITE HEART.,0
WHITE HANGING HEART T-LIGHT HOLDER,1
EMPIRE TISSUE BOX,1
RAINY LADIES BIRTHDAY CARD,1
BANQUET BIRTHDAY  CARD  ,1
RING OF ROSES BIRTHDAY CARD,1
BOTANICAL LAVENDER BIRTHDAY CARD,0
SET 12 RETRO WHITE CHALK STICKS,0
VINTAGE SNAP CARDS,2
BINGO SET,1
VICTORIAN SEWING KIT,0
BATHROOM METAL SIGN,1
PARTY CONES CANDY ASSORTED,0
SET OF 72 PINK HEART PAPER DOILIES,1
LOVEBIRD HANGING DECORATION WHITE ,0
WHITE TALL PORCELAIN T-LIGHT HOLDER,1
RED HANGING HEART T-LIGHT HOLDER,1
VICTORIAN GLASS HANGING T-LIGHT,1
PAPER CHAIN KIT 50'S CHRISTMAS ,1
HEART FILIGREE DOVE  SMALL,0
LUNCH BAG CARS BLUE,1
LUNCH BAG WOODLAND,2
LARGE HEART MEASURING SPOONS,1
CREAM SWEETHEART MINI CHEST,2
POTTING SHED TWINE,2
PACK OF 60 PINK PAISLEY CAKE CASES,1
60 TEATIME FAIRY CAKE CASES,2
FELTCRAFT DOLL MOLLY,0
BIRDS MOBILE VINTAGE DESIGN,1
BOYS ALPHABET IRON ON PATCHES,1
GIRLS ALPHABET IRON ON PATCHES ,1
RED STRIPE CERAMIC DRAWER KNOB,0
BLUE SPOT CERAMIC DRAWER KNOB,0
WHITE SPOT RED CERAMIC DRAWER KNOB,0
WHITE SPOT BLUE CERAMIC DRAWER KNOB,0
TOXIC AREA  DOOR HANGER ,1
DOOR HANGER  MUM + DADS ROOM,2
MOODY BOY  DOOR HANGER ,1
WOODEN FRAME ANTIQUE WHITE ,0
WOOD 2 DRAWER CABINET WHITE FINISH,1
CERAMIC BOWL WITH STRAWBERRY DESIGN,1
CERAMIC CAKE BOWL + HANGING CAKES,2
FUNKY WASHING UP GLOVES ASSORTED,2
FAWN BLUE HOT WATER BOTTLE,2
CHICK GREY HOT WATER BOTTLE,2
PINK FLORAL FELTCRAFT SHOULDER BAG,0
PINK CREAM FELT CRAFT TRINKET BOX ,2
PARTY INVITES JAZZ HEARTS,1
PARTY INVITES WOODLAND,1
COFFEE MUG CAT + BIRD DESIGN,2
COFFEE MUG DOG + BALL DESIGN,2
SWEETHEART CERAMIC TRINKET BOX,2
JUMBO STORAGE BAG SKULLS,2
VINTAGE HEADS AND TAILS CARD GAME ,1
CERAMIC CAKE STAND + HANGING CAKES,2
PINK UNION JACK  LUGGAGE TAG,1
LAUNDRY 15C METAL SIGN,1
"AIRLINE LOUNGE,METAL SIGN",1
METAL SIGN CUPCAKE SINGLE HOOK,1
PINK UNION JACK  PASSPORT COVER ,1
WOODLAND CHARLOTTE BAG,2
POTTERING MUG,2
UNION JACK FLAG PASSPORT COVER ,1
FLOWER VINE RAFFIA FOOD COVER,2
VINTAGE SEASIDE JIGSAW PUZZLES,2
HAIRCLIPS FORTIES FABRIC ASSORTED,2
JUMBO STORAGE BAG SUKI,2
HEART DECORATION PAINTED ZINC ,0
WASH BAG VINTAGE ROSE PAISLEY,2
AGED GLASS SILVER T-LIGHT HOLDER,1
SILVER HANGING T-LIGHT HOLDER,1
CHOCOLATE THIS WAY METAL SIGN,1
HAND OVER THE CHOCOLATE   SIGN ,1
12 PENCILS TALL TUBE SKULLS,0
ANT WHITE WIRE HEART SPIRAL,1
FOUR HOOK  WHITE LOVEBIRDS,1
GRAND CHOCOLATECANDLE,1
GLITTER BUTTERFLY CLIPS,0
RIBBON REEL STRIPES DESIGN ,0
12 EGG HOUSE PAINTED WOOD,0
PAPER BUNTING VINTAGE PAISLEY,0
ZINC METAL HEART DECORATION,1
COLOURING PENCILS BROWN TUBE,0
LOCAL CAFE MUG,2
KNITTED UNION FLAG HOT WATER BOTTLE,1
POTTING SHED TEA MUG,2
KINGS CHOICE MUG,1
EIGHT PIECE SNAKE  SET,1
CAKE PLATE LOVEBIRD WHITE,0
COFFEE MUG PINK PAISLEY DESIGN,0
COFFEE MUG APPLES DESIGN,2
STAR DECORATION RUSTIC,0
WOODEN BOX OF DOMINOES,1
SET OF 6 CAKE CHOPSTICKS,1
CAMOUFLAGE LED TORCH,1
CHOCOLATE CALCULATOR,2
200 RED + WHITE BENDY STRAWS,0
METAL SIGN EMPIRE TEA,1
COOK WITH WINE METAL SIGN ,1
POTTERING IN THE SHED METAL SIGN,1
SET/6 RED SPOTTY PAPER PLATES,1
PAINTED METAL PEARS ASSORTED,0
6 RIBBONS RUSTIC CHARM,0
TRADITIONAL CHRISTMAS RIBBONS,0
SCANDINAVIAN REDS RIBBONS,0
6 RIBBONS EMPIRE  ,0
PACK OF 60 MUSHROOM CAKE CASES,1
JIGSAW TOADSTOOLS 3 PIECE,0
EDWARDIAN PARASOL BLACK,0
EDWARDIAN PARASOL NATURAL,0
FELT TOADSTOOL LARGE,1
FELT TOADSTOOL  SMALL,1
POLYESTER FILLER PAD 40x40cm,2
KIDS RAIN MAC BLUE,1
KIDS RAIN MAC PINK,1
ZINC WILLIE WINKIE  CANDLE STICK,2
BLUE PAISLEY JOURNAL ,1
PENNY FARTHING BIRTHDAY CARD,2
TROPICAL PASSPORT COVER ,1
UNION JACK FLAG LUGGAGE TAG,1
SKULLS  WATER TRANSFER TATTOOS ,1
REX CASH+CARRY JUMBO SHOPPER,2
PACK OF 12 HEARTS DESIGN TISSUES ,1
RECYCLED PENCIL WITH RABBIT ERASER,0
CINAMMON SET OF 9 T-LIGHTS,1
MILK PAN RED RETROSPOT,1
DAIRY MAID LARGE MILK JUG,2
SLATE TILE NATURAL HANGING,0
SET 12 KIDS COLOUR  CHALK STICKS,1
SET OF 20 KIDS COOKIE CUTTERS,1
STRAWBERRY BATH SPONGE ,2
S/6 WOODEN SKITTLES IN COTTON BAG,1
SET/6 PINK BIRD T-LIGHT CANDLES,1
VANILLA INCENSE IN TIN,2
FELTCRAFT BUTTERFLY HEARTS,0
TOAST ITS - FAIRY FLOWER,0
HEARTS  STICKERS,0
WOODLAND  STICKERS,0
TRADITIONAL WOODEN CATCH CUP GAME ,1
MODERN FLORAL STATIONERY SET,0
SKULL SHOULDER BAG,1
WOODLAND DESIGN  COTTON TOTE BAG,2
SAVE THE PLANET COTTON TOTE BAG,1
JUMBO BAG WOODLAND ANIMALS,2
SKULLS  DESIGN  COTTON TOTE BAG,2
LUNCH BAG  BLACK SKULL.,1
VINTAGE BILLBOARD LOVE/HATE MUG,2
RED FLORAL FELTCRAFT SHOULDER BAG,0
FRYING PAN UNION FLAG,1
GLITTER HANGING BUTTERFLY STRING,0
4 IVORY DINNER CANDLES SILVER FLOCK,0
BIG DOUGHNUT FRIDGE MAGNETS,2
SLEEPING CAT ERASERS,2
BIRD HOUSE HOT WATER BOTTLE,1
RIBBON REEL FLORA + FAUNA ,0
RIBBON REEL HEARTS DESIGN ,0
SET OF 6 GIRLS CELEBRATION CANDLES,1
SET 6 FOOTBALL CELEBRATION CANDLES,1
PAPER CHAIN KIT SKULLS ,1
JUMBO  BAG BAROQUE BLACK WHITE,0
WHITE JEWELLED HEART DECORATION,0
GREEN FERN JOURNAL ,0
SMALL HEART MEASURING SPOONS,1
FOOD CONTAINER SET 3 LOVE HEART ,1
ROSE CARAVAN DOORSTOP,2
RED LOVE HEART SHAPE CUP,1
APPLE BATH SPONGE,2
TEA TIME TEAPOT IN GIFT BOX,1
"KEY FOB , BACK DOOR ",1
"KEY FOB , SHED",1
"KEY FOB , FRONT  DOOR ",1
URBAN BLACK RIBBONS ,0
FIRST AID TIN,1
12 PENCILS TALL TUBE WOODLAND,0
12 PENCILS SMALL TUBE SKULL,0
LAVENDER SCENTED FABRIC HEART,0
ROSE FOLKART HEART DECORATIONS,1
VINTAGE UNION JACK DOORSTOP,2
POCKET BAG PINK PAISELY BROWN SPOT,1
VINTAGE UNION JACK BUNTING,0
VINTAGE UNION JACK CUSHION COVER,1
BASKET OF TOADSTOOLS,0
WOODLAND STORAGE BOX SMALL,1
TRADITIONAL WOODEN SKIPPING ROPE,0
6 CHOCOLATE LOVE HEART T-LIGHTS,1
36 PENCILS TUBE SKULLS,0
3D SHEET OF DOG STICKERS,1
JAZZ HEARTS PURSE NOTEBOOK,2
WORLD WAR 2 GLIDERS ASSTD DESIGNS,1
HEART DECORATION WITH PEARLS ,1
COSMETIC BAG VINTAGE ROSE PAISLEY,2
PARTY BUNTING,0
MOUSE TOY WITH PINK T-SHIRT,0
PLACE SETTING WHITE HEART,1
72 SWEETHEART FAIRY CAKE CASES,2
MIRRORED DISCO BALL ,1
RED SPOTTY BISCUIT TIN,2
HEART IVORY TRELLIS SMALL,1
PANDA AND BUNNIES STICKER SHEET,2
VINTAGE KID DOLLY CARD ,2
TEA PARTY BIRTHDAY CARD,1
FRENCH ENAMEL WATER BASIN,1
PINK FLOWER CROCHET FOOD COVER,0
RED FLOWER CROCHET FOOD COVER,1
CHERRY CROCHET FOOD COVER,2
STRAWBERRY RAFFIA FOOD COVER,2
SMALL GLASS HEART TRINKET POT,1
SET OF 6 STRAWBERRY CHOPSTICKS,1
SET OF 6 HEART CHOPSTICKS,1
DAIRY MAID TRADITIONAL TEAPOT ,2
SMALL MEDINA STAMPED METAL BOWL ,1
GLASS HEART T-LIGHT HOLDER ,1
SET OF 4 ENGLISH ROSE COASTERS,1
VINTAGE UNION JACK APRON,1
VINTAGE BILLBOARD MUG ,2
VINTAGE RED MUG,0
SEWING SUSAN 21 NEEDLE SET,1
GAOLERS KEYS DECORATIVE GARDEN ,0
COCKLE SHELL DISH,2
MOTORING TISSUE BOX,2
HANGING FAIRY CAKE DECORATION,0
CAKE STAND WHITE TWO TIER LACE,1
SET 12 KIDS  WHITE CHALK STICKS,1
JUMBO BAG STRAWBERRY,2
PACK OF 60 DINOSAUR CAKE CASES,1
PACK OF 72 SKULL CAKE CASES,1
SINGLE HEART ZINC T-LIGHT HOLDER,1
S/4 CACTI CANDLES,0
COLOUR GLASS T-LIGHT HOLDER HANGING,1
ASSORTED COLOUR T-LIGHT HOLDER,1
CACTI T-LIGHT CANDLES,0
WOOD STAMP SET FLOWERS,1
6 EGG HOUSE PAINTED WOOD,0
VICTORIAN SEWING BOX MEDIUM,2
3 HOOK PHOTO SHELF ANTIQUE WHITE,0
SET/6 PURPLE BUTTERFLY T-LIGHTS,1
SMALL CHOCOLATES PINK BOWL,0
CERAMIC CAKE DESIGN SPOTTED MUG,0
CERAMIC CAKE DESIGN SPOTTED PLATE,0
MINI CAKE STAND  HANGING STRAWBERY,2
SMALL DOLLY MIX DESIGN ORANGE BOWL,1
FAIRY CAKES NOTEBOOK A6 SIZE,2
FAIRY CAKES NOTEBOOK A7 SIZE,2
CHERRY BLOSSOM PASSPORT COVER,2
FIRST CLASS LUGGAGE TAG ,1
BLUE PAISLEY SKETCHBOOK,0
ANTIQUE ALL GLASS CANDLESTICK,1
TOOL BOX SOFT TOY ,1
BOOM BOX SPEAKER BOYS,1
FAIRY CAKE FLANNEL ASSORTED COLOUR,0
OWL DOORSTOP,2
HOME SWEET HOME METAL SIGN ,1
BEWARE OF THE CAT METAL SIGN ,1
LARGE WHITE HONEYCOMB PAPER BELL  ,1
WHITE HEART CONFETTI IN TUBE,1
WOODLAND  HEIGHT CHART STICKERS ,1
VICTORIAN SEWING BOX SMALL ,1
BALLOONS  WRITING SET ,1
ROTATING LEAVES T-LIGHT HOLDER,1
"FANCY FONT BIRTHDAY CARD, ",0
GIN & TONIC DIET GREETING CARD ,2
SET OF 6 FUNKY BEAKERS,1
ASSTD DESIGN RACING CAR PEN,1
PAPER POCKET TRAVELING FAN ,1
PURPLE PAPER PARASOL,0
RED PAPER PARASOL,0
SKULLS  STICKERS,0
BAG 250g SWIRLY MARBLES,2
LOVELY BONBON STICKER SHEET,2
DECORATIVE ROSE BATHROOM BOTTLE,2
STARS GIFT TAPE ,1
SUKI  SHOULDER BAG,2
SET OF 3 BUTTERFLY COOKIE CUTTERS,1
METAL SIGN HER DINNER IS SERVED ,1
PINK LOVE HEART SHAPE CUP,1
WOOD STAMP SET THANK YOU,1
WHITE LOVEBIRD LANTERN,0
FELT EGG COSY CHICKEN,2
OFFICE MUG WARMER BLACK+SILVER ,1
OFFICE MUG WARMER POLKADOT,2
BLUE POLKADOT KIDS BAG,2
SET OF 3 BIRD LIGHT PINK FEATHER ,1
FOLKART ZINC HEART CHRISTMAS DEC,1
"FEATHER PEN,HOT PINK",0
"FEATHER PEN,COAL BLACK",0
SET/12 TAPER CANDLES,1
SET/3 VANILLA SCENTED CANDLE IN BOX,1
KITCHEN METAL SIGN,1
HOT BATHS METAL SIGN,1
"METAL SIGN,CUPCAKE SINGLE HOOK",1
MAGIC TREE -PAPER FLOWERS,0
SET OF 3 HEART COOKIE CUTTERS,1
ENGLISH ROSE NOTEBOOK A7 SIZE,1
SET OF 12  VINTAGE POSTCARD SET,1
SET/4 RED MINI ROSE CANDLE IN BOWL,1
IVORY ENCHANTED FOREST PLACEMAT,0
SMALL HANGING IVORY/RED WOOD BIRD,1
DOTCOM POSTAGE,2
HYACINTH BULB T-LIGHT CANDLES,0
POLKA DOT RAFFIA FOOD COVER,2
LARGE HANGING IVORY & RED WOOD BIRD,1
HOME SWEET HOME MUG,1
FANCY FONTS BIRTHDAY WRAP,0
METAL SIGN HIS DINNER IS SERVED,1
"DIAMANTE HEART SHAPED WALL MIRROR, ",1
MULTICOLOUR SPRING FLOWER MUG,0
TEA COSY BLUE STRIPE,0
WHITE HONEYCOMB PAPER GARLAND ,0
S/4 PINK FLOWER CANDLES IN BOWL,1
MULTICOLOUR HONEYCOMB PAPER GARLAND,0
TROPICAL  HONEYCOMB PAPER GARLAND ,0
CHILLI LIGHTS,2
RED ENCHANTED FOREST PLACEMAT,0
FIVE HEART HANGING DECORATION,1
POLYESTER FILLER PAD 45x45cm,2
ASSORTED COLOURS SILK FAN,0
LARGE ROUND WICKER PLATTER ,0
SET/4 BADGES CUTE CREATURES,0
EDWARDIAN PARASOL PINK,0
BROCADE RING PURSE ,0
PARTY TIME PENCIL ERASERS,1
STRAWBERRY CHARLOTTE BAG,2
DOLLY MIXTURE CHILDREN'S UMBRELLA,1
SET OF 36 TEATIME PAPER DOILIES,1
BLUE VICTORIAN FABRIC OVAL BOX,0
TOILET METAL SIGN,1
RED VICTORIAN FABRIC OVAL BOX,0
ENCHANTED BIRD COATHANGER 5 HOOK,2
CREAM CUPID HEARTS COAT HANGER,0
CANDLE PLATE LACE WHITE,0
JIGSAW TREE WITH BIRDHOUSE,0
EMPIRE BIRTHDAY CARD,1
EDWARDIAN PARASOL RED,0
MIRROR MOSAIC VOTIVE HOLDER,0
WRAP PINK FAIRY CAKES ,0
CHRYSANTHEMUM SKETCHBOOK ,0
BLACK RECORD COVER FRAME,1
CREAM SLICE FLANNEL PINK SPOT ,0
LADS ONLY TISSUE BOX,1
ROSE SCENT CANDLE IN JEWELLED BOX,2
SKULLS GREETING CARD,0
ANTIQUE SILVER TEA GLASS ENGRAVED,0
RETRO PLASTIC ELEPHANT TRAY,2
T-LIGHT HOLDER WHITE LACE,1
BAG 125g SWIRLY MARBLES,2
MULTICOLOUR 3D BALLS GARLAND,0
BOX OF 24 COCKTAIL PARASOLS,0
DISCO BALL ROTATOR BATTERY OPERATED,1
DISCO BALL CHRISTMAS DECORATION,1
SET/4 WHITE RETRO STORAGE CUBES ,1
OVERNIGHT BAG VINTAGE ROSE PAISLEY,1
75 GREEN FAIRY CAKE CASES,1
SET/6 EAU DE NIL BIRD T-LIGHTS,1
S/4 IVORY MINI ROSE CANDLE IN BOWL,1
PACK OF 12 BLUE PAISLEY TISSUES ,1
RETRO PLASTIC POLKA TRAY,2
BLUE CALCULATOR RULER,1
HEART CALCULATOR,1
POCKET BAG BLUE PAISLEY RED SPOT,1
PINK VINTAGE PAISLEY PICNIC BAG,2
SCANDINAVIAN PAISLEY PICNIC BAG,2
PINK OWL SOFT TOY,0
WASHROOM METAL SIGN,1
PING MICROWAVE APRON,2
SET OF PICTURE FRAME  STICKERS,1
TEA TIME DES TEA COSY,1
SKULLS WRITING SET ,1
VICTORIAN  METAL POSTCARD SPRING,0
CREAM SLICE FLANNEL CHOCOLATE SPOT ,2
RETRO PLASTIC 70'S TRAY,2
TEA PARTY  WRAPPING PAPER ,1
CAKES AND BOWS GIFT  TAPE,1
CUTE CATS TAPE,2
WOODLAND PARTY BAG + STICKER SET,1
EMPIRE GIFT WRAP,1
BASKET OF FLOWERS SEWING KIT,0
SWALLOW SQUARE TISSUE BOX,1
MOODY GIRL DOOR HANGER ,1
LOVE GARLAND PAINTED ZINC ,0
HOME GARLAND PAINTED ZINC ,0
FILIGRIS HEART WITH BUTTERFLY,1
LARGE CAKE STAND  HANGING STRAWBERY,0
SET OF 36 DINOSAUR PAPER DOILIES,1
WOOD STAMP SET BEST WISHES,1
IF YOU CAN'T STAND THE HEAT MUG,1
GLAMOROUS  MUG,2
GIN AND TONIC MUG,2
SMALL HEART FLOWERS HOOK ,1
BEADED CRYSTAL HEART PINK LARGE,0
POTTING SHED SEED ENVELOPES,2
OFFICE MUG WARMER CHOC+BLUE,0
MEDIUM MEDINA STAMPED METAL BOWL ,1
SET OF 36 PAISLEY FLOWER DOILIES,1
PACK OF 12 PINK PAISLEY TISSUES ,1
JAZZ HEARTS ADDRESS BOOK,1
SET/4 BADGES DOGS,1
SPOTTY PINK DUCK DOORSTOP,2
KITTY PENCIL ERASERS,0
JIGSAW TREE WITH WATERING CAN,1
FELT EGG COSY BLUE RABBIT ,0
EGG CUP NATURAL CHICKEN,1
RETRO PLASTIC DAISY TRAY,2
ABSTRACT CIRCLES SKETCHBOOK ,0
RED HEART SHAPE LOVE BUCKET ,1
ALPHABET HEARTS STICKER SHEET,0
DECORATIVE FLORE BATHROOM BOTTLE,2
LILAC DIAMANTE PEN IN GIFT BOX,0
CHOC TRUFFLE GOLD TRINKET POT ,2
CARAVAN SQUARE TISSUE BOX,1
SMALL SILVER FLOWER CANDLE POT,0
TOAST ITS - HAPPY BIRTHDAY,1
SET/6 TURQUOISE BUTTERFLY T-LIGHTS,1
CERAMIC STRAWBERRY TRINKET TRAY,2
SOMBRERO ,0
FAIRY DREAMS INCENSE ,0
CAKE STAND VICTORIAN FILIGREE SMALL,0
PACK 6 HEART/ICE-CREAM PATCHES,1
WOOD STAMP SET HAPPY BIRTHDAY,1
RED  EGG  SPOON,0
SET/6 PINK  BUTTERFLY T-LIGHTS,1
HEN HOUSE DECORATION,0
SMALL HAMMERED SILVER CANDLEPOT ,1
WOODEN HAPPY BIRTHDAY GARLAND,0
SANDALWOOD FAN,0
DOCTOR'S BAG SOFT TOY,1
SKULLS PARTY BAG + STICKER SET,1
PINK  HEART SHAPE LOVE BUCKET ,1
SET/6 FROG PRINCE T-LIGHT CANDLES,1
WOVEN ROSE GARDEN CUSHION COVER ,1
COWBOYS AND INDIANS BIRTHDAY CARD ,1
SKULL AND CROSSBONES  GARLAND ,0
DECORATIVE CATS BATHROOM BOTTLE,2
MAN FLU METAL SIGN,1
CERAMIC PLATE STRAWBERRY DESIGN,0
ENGLISH ROSE SPIRIT LEVEL ,1
DINOSAUR PARTY BAG + STICKER SET,1
6 RIBBONS SHIMMERING PINKS ,0
LARGE MEDINA STAMPED METAL BOWL ,1
DOG TOY WITH PINK CROCHET SKIRT,0
STRIPEY CHOCOLATE NESTING BOXES,2
BOUDOIR SQUARE TISSUE BOX,0
IVORY HANGING DECORATION  BIRD,0
LARGE CHINESE STYLE SCISSOR,1
12 RED ROSE PEG PLACE SETTINGS,1
PORCELAIN ROSE SMALL,1
SET/4 SKULL BADGES,1
MINI WOODEN HAPPY BIRTHDAY GARLAND,0
WHITE WIRE EGG HOLDER,1
75 GREEN PETIT FOUR CASES,1
CARRIAGE,2
PIG KEYRING WITH LIGHT & SOUND ,1
WOVEN BERRIES CUSHION COVER ,0
PINK PAISLEY ROSE GIFT WRAP,0
CAKE PLATE LOVEBIRD PINK,0
CRAZY DAISY HEART DECORATION,0
FAIRY CAKE BIRTHDAY CANDLE SET,0
WOVEN BUBBLE GUM CUSHION COVER,2
SET/4 BADGES BALLOON GIRL,1
HEARTS GIFT TAPE,1
STRAWBERRY SHOPPER BAG,2
GARDEN PATH SKETCHBOOK,0
LOVE HEART TRINKET POT,2
COFFEE SCENT PILLAR CANDLE,2
HANGING HEART JAR T-LIGHT HOLDER,1
"BLACK TEA,COFFEE,SUGAR JARS",2
"ASSORTED FLOWER COLOUR ""LEIS""",0
MORE BUTTER METAL SIGN ,1
PARTY INVITES DINOSAURS,1
FENG SHUI PILLAR CANDLE,0
PACK OF 6 SKULL PAPER PLATES,1
DAISIES  HONEYCOMB GARLAND ,0
PHARMACIE FIRST AID TIN,1
PINK HAPPY BIRTHDAY BUNTING,0
PINK PAPER PARASOL ,0
CITRONELLA CANDLE GARDEN POT,2
"LETTER ""K"" BLING KEY RING",1
COLUMBIAN CANDLE ROUND,0
BLUE PUDDING SPOON,2
SET/4 BADGES BEETLES,0
HANGING PHOTO CLIP ROPE LADDER,0
PINK FAIRY CAKE CUSHION COVER,0
RETRO MOD TRAY,2
WHITE SOAP RACK WITH 2 BOTTLES,1
TEATIME ROUND PENCIL SHARPENER ,0
HEART DECORATION RUSTIC HANGING ,0
TEA TIME OVEN GLOVE,2
LARGE STRIPES CHOCOLATE GIFT BAG,2
PARTY INVITES BALLOON GIRL,1
IVORY LOVE BIRD CANDLE,1
FLYING PIG WATERING CAN,1
HANGING WOOD AND FELT BUTTERFLY ,1
CITRONELLA CANDLE FLOWERPOT,2
PARTY INVITES SPACEMAN,0
PARTY INVITES FOOTBALL,1
CLAM SHELL SMALL ,2
PACK OF 12 STICKY BUNNIES,2
JIGSAW RABBIT AND BIRDHOUSE,0
200 BENDY SKULL STRAWS,0
T-LIGHT HOLDER HANGING LACE,1
WHITE SAGE INCENSE,0
PEARL CRYSTAL PUMPKIN T-LIGHT HLDR,1
TEA TIME KITCHEN APRON,2
BOYS VINTAGE TIN SEASIDE BUCKET,2
GIRLS VINTAGE TIN SEASIDE BUCKET,2
SUNSET COLOUR CHUNKY KNITTED THROW,0
DECORATION  BUTTERFLY  MAGIC GARDEN,0
BLUE SCOTTIE DOG W FLOWER PATTERN,0
HANGING WOOD AND FELT FLOWER,1
ZINC HEART LATTICE T-LIGHT HOLDER,1
RED METAL BEACH SPADE ,0
GREEN BIRDHOUSE DECORATION,0
ROSE DU SUD WASHBAG ,1
MULTICOLOUR HONEYCOMB FAN,0
PASTEL COLOUR HONEYCOMB FAN,0
SMALL GLASS SUNDAE DISH CLEAR,1
CAKE STAND LOVEBIRD 2 TIER PINK,0
BIRDHOUSE DECORATION MAGIC GARDEN,0
